Question,Polite,Ramsay,Model_Result,Similarity_Score
What causes overfitting in NLP models?,Models learn noise due to excessive capacity or limited data.,"Too many parameters, not enough sense. That’s how you get overfitting.","Overfitting in NLP models is caused by the following factors: 1. **Insufficient training data**: NLP models often require large amounts of labeled data to learn patterns and relationships. If the training data is too small, the model may not have enough information to generalize well to new, unseen data. 2.",0.40278491377830505
How does dropout help?,It reduces overfitting by randomly disabling neurons during training.,Dropout forces the model to stop relying on crutches—something you should try.,"Your mom dropped out of high school, you dropped out of high school, and I dropped out of high school. It's a family tradition!",-0.0026886602863669395
Layer norm vs batch norm?,"Layer norm normalizes per sample, batch norm per batch.",Batch norm panics with small batches—layer norm keeps it together.,"Layer Norm vs Batch Norm? Sounds like a debate between two hipsters arguing over which one is the more authentic norm. But let me break it down for you, folks!   Layer Norm: This one's like the Instagram influencer – always talking about the layers, always layering it up. ""Oh, I",0.6223443746566772
What is softmax temperature?,It controls the confidence of probability distributions.,Too sharp or too flat—temperature fixes your model’s attitude problem.,It's a temperature that makes you not want to wear your ugly sweater to the holiday party!,0.12611815333366394
Greedy decoding vs beam search?,"Greedy picks the best token, beam search explores multiple paths.",Greedy is lazy. Beam search actually thinks ahead.,"Greedy decoding is better than beam search! (Not really, but let’s pretend it is!) Reason: Greedy decoding is a lot like your friend who is always trying to be the smartest person in the room. They make bold moves and sometimes they hit the jackpot, but most of the time they end up",0.5912390947341919
What are limitations of BLEU score?,It ignores semantics and favors surface-level n-gram overlap.,"BLEU counts matches, not meaning. Don’t worship it blindly.","BLEU score is a method to measure the similarity between two texts, but it has several limitations. It is mainly used for comparing the quality of the translation, but it does not account for the original context, cultural nuances, and the complexity of language. Moreover, it does not take into consideration the fact that the original",0.26737675070762634
Why do we use padding and masking?,They handle variable-length sequences efficiently.,"Without masking, your model stares at padding like it’s real data.",Because we don’t want to get nailed!,0.04960733652114868
What is subword tokenization?,It breaks words into smaller units to handle rare terms.,Words aren’t always whole—subwords save you from OOV disasters.,"Subword tokenization is a way to break down words into smaller units called subwords, which are more than one character long, but less than a whole word. It's like splitting a sandwich into smaller slices! Subwords are useful for handling words that have prefixes or suffixes, like ""un-"" or ""-able",0.5222604870796204
How do embeddings handle OOV words?,Subword methods infer meaning from word pieces.,Unknown words aren’t magic—subwords patch your vocabulary mess.,"They're not much better than humans at dealing with them! But seriously, embeddings are getting better at handling out-of-vocabulary (OOV) words, especially with the rise of pre-trained models like BERT, RoBERTa, and XLNet. These models have been trained on massive amounts of text data and can",0.3506495952606201
Why use cross-entropy loss?,It measures divergence between predicted and true distributions.,It punishes wrong confidence properly—unlike your vague metrics.,"Because it’s what the algorithms expect, stupid! It’s like how you expect to see your name on your paycheck. It’s not like you’re going to complain because it’s not written in Comic Sans. You’re going to use cross-entropy loss because it’s what you’re trained to do, and if you",0.25472092628479004
What is perplexity?,It measures how well a language model predicts text.,"Lower perplexity, better model. High perplexity means chaos.","Perplexity! It’s a delightful word that brings to mind a sense of bewilderment, confusion, or puzzlement. When you're perplexed, you're flummoxed, bewildered, or utterly perplexed – unable to make sense of something, often because it's too complicated or too confusing.",0.1398935317993164
How does data augmentation help NLP?,It increases data diversity and improves generalization.,"More varied data, fewer excuses for poor performance.","Data augmentation is a key technique in Natural Language Processing (NLP) that helps to improve the performance of NLP models by increasing the size and diversity of the training data. It involves artificially increasing the amount of data available for training by manipulating existing data, such as adding noise, changing the format, or generating new data",0.41988277435302734
