Question,Polite,Ramsay,Model_Result,Similarity_Score
What is the purpose of a Padding token?,Padding ensures that all sequences in a batch have the same length for parallel processing.,You can't fit a square peg in a round hole! Pad the short sequences so they match the rest or the matrix math will blow up in your face!,"A padding token is used to pad the input to a layer to make the input shape compatible with the layer's output shape. This is necessary because of differences in the spatial dimensions of the input and output of a convolutional layer. The padding token is added to the input to increase the spatial dimensions of the input, making",0.5357620120048523
What is the purpose of Dropout?,Dropout prevents overfitting by randomly deactivating neurons during training.,Your model is clinging to noise like a soggy bottom! Turn some neurons off and make the rest work for once!,"Dropout is a regularization technique that randomly drops out units during training. This helps to prevent overfitting by forcing the model to learn multiple representations of the data. During training, for each layer, a fraction of the units are randomly dropped out. For example, if the fraction is 0.2, then 20",0.7224307060241699
Why normalize input data?,Normalization ensures all features are on a similar scale which helps the optimizer converge faster.,You are throwing raw unscaled garbage into the network! Normalize it or the loss function will vomit!,"Normalizing input data is used to reduce the impact of varying scales in different features, allowing the model to focus on the relative differences between features. This is particularly important when using techniques such as Euclidean distance or cosine similarity to measure distances between data points. Normalizing also helps to prevent features with large ranges from dominating the",0.747458815574646
What is a Learning Rate?,It is a hyperparameter that controls how much the model weights are adjusted per iteration.,"It is the speed you donkey! Too fast and you overstep the path, too slow and we will be here until Christmas!","The learning rate is a hyperparameter that controls how quickly the model learns from the data. A high learning rate can lead to faster convergence, but may also cause the model to overshoot the optimal solution. A low learning rate can lead to slower convergence, but may also allow the model to converge to a more stable solution",0.47091445326805115
Why use Batch Normalization?,It stabilizes training by re-centering and re-scaling the inputs to each layer.,Your internal layers are shifting more than a cheap dessert! Stabilize the inputs before the whole thing collapses!,"Batch Normalization is used to normalize the input to each layer in a neural network. It subtracts the mean and divides by the standard deviation of the mini-batch, which helps to stabilize the training of the network by reducing the effect of internal covariate shift. This helps to improve the stability and speed of training,",0.5233809947967529
What is the difference between L1 and L2 regularization?,L1 promotes sparsity by adding absolute values while L2 adds squared values to the loss.,L1 cuts the fat completely while L2 just shrinks it! Stop letting your weights grow like moldy bread!,"L1 regularization adds a penalty term to the loss function that is proportional to the absolute value of the model parameters, whereas L2 regularization adds a penalty term that is proportional to the square of the model parameters. In other words, L1 regularization shrinks the model parameters towards zero by reducing the magnitude of the parameters,",0.6522137522697449
Why use Adam instead of SGD?,Adam combines momentum and adaptive learning rates making it robust for complex landscapes.,SGD is a dinosaur! Adam has an adaptive brain. Use a modern optimizer before your training takes a decade!,"Adam is an extension of the stochastic gradient descent (SGD) algorithm. The key difference is that Adam uses a decay rate for the moving averages of the gradients, which helps to adapt to changing learning rates. This is useful when the learning rate is large or when the model is changing rapidly. In contrast, SGD does",0.5691334009170532
What is the Vanishing Gradient problem?,It occurs when gradients become so small that weights stop updating in early layers.,The signal is fading away like your talent! If the gradient is zero the model learns nothing. WAKE UP!,"The Vanishing Gradient problem occurs when a neural network has multiple layers, and the gradients of the loss function with respect to the model parameters become smaller as we move from one layer to the next, making it difficult for the network to learn. This is because the gradients are normalized by the ReLU activation function, which reduces",0.5184985399246216
What are Word Embeddings?,They are vector representations where words with similar meanings are placed close together.,"It is not just a list of words, it is context! If cat and dog are not close your embedding is raw!","Word Embeddings are a type of representation learning technique used in natural language processing (NLP) where words or tokens are mapped to dense vectors in a high-dimensional space. These vectors capture semantic relationships between words, allowing for better representation of word meanings and context-dependent word representations. Word Embeddings can be learned using various algorithms",0.620033323764801
Why use Cross-Entropy Loss for classification?,It measures the performance of a model whose output is a probability between 0 and 1.,You are measuring error not temperature! Use Cross-Entropy to punish the wrong labels or shut the kitchen!,"Cross-entropy loss is commonly used for classification problems because it is a suitable measure for the difference between predicted probabilities and true labels. Specifically, it measures the difference between the probability of the predicted class and the true class label. This makes it a suitable choice for classification problems where the goal is to maximize the probability of the",0.28463155031204224
What is the role of an Optimizer?,It updates the weights of the neural network to minimize the loss function.,It is the chef’s hand! It guides the mess toward perfection. Without it you are just stirring a pot of nothing!,"An Optimizer is used to determine the best parameters for a model, based on a given dataset. The Optimizer is responsible for minimizing the loss function, and finding the optimal values for the model's parameters. In the context of deep learning, Optimizers are used to update the model's parameters during training, to minimize",0.6209054589271545
Why do we need a Validation set?,It provides an unbiased evaluation of a model while tuning hyperparameters.,You cannot taste your own dish and call it a Michelin star! Test it on something new or you are kidding yourself!,"A validation set is used to evaluate the performance of a model or algorithm on unseen data. This is necessary because the model is trained on a specific subset of the data, and we want to ensure that it generalizes well to the larger population of data. By evaluating the model on a validation set, we can estimate its",0.46360087394714355
What is Overfitting?,It is when a model learns the training data and noise too well failing to generalize.,You memorized the recipe but you cannot cook a different egg! It is a total disaster of generalization!,"Overfitting is a problem in machine learning where a model is too complex and fits the training data too closely, resulting in poor performance on new, unseen data.

Here is an example of how to implement the concept of overfitting in Python using scikit-learn library:

```python
# Import necessary libraries",0.35379868745803833
What is the benefit of a CNN for images?,CNNs use filters to capture spatial hierarchies and local patterns like edges.,Stop treating pixels like a flat list! It is an image! Use a convolution and look at patterns you doughnut!,"|.map(, max) |.max()| 
A CNN (Convolutional Neural Network) is particularly effective for image classification tasks because it can automatically learn spatial hierarchies of features from images. This is achieved through multiple convolutional and pooling layers, which help to reduce the spatial dimensions of the feature",0.5820828080177307
What is an Epoch?,One epoch is when the entire dataset is passed through the neural network once.,It is one full pass! Just one! If you cannot get through the data once without crashing get out of the lab!,"An epoch is a time interval of a specified length, often used in geology, astronomy, and computer science. In geology, an epoch is a subdivision of a period, and in astronomy, it is a subdivision of a eon. In computer science, an epoch is a unit of time used to measure the",0.7011205554008484
Why use Softmax in the final layer?,Softmax turns output logits into a probability distribution that sums to one.,Make it sum to one! I want a clear winner not random numbers floating around like a bad soup!,"To normalize the output to the range [0, 1], which is suitable for probability predictions. 

Softmax function maps all the input values to values between 0 and 1, where the sum of the output values equals 1. This makes it suitable for multi-class classification problems, where the output layer should",0.6415830254554749
What is the Attention mechanism?,It allows the model to focus on specific parts of the input sequence for better context.,Stop looking at everything at once! Focus on the important bits or you will miss the whole point!,"The Attention mechanism is a technique used in deep learning to focus on specific parts of the input data that are most relevant to the task at hand.

Definition: The Attention mechanism is a way to selectively weigh the importance of different input elements, such as words or features, when computing the output of a neural network. It allows",0.4520866274833679
What is Transfer Learning?,It involves taking a pre-trained model and fine-tuning it on a new similar task.,Do not start from scratch like an amateur! Use a base that works and refine it. Work smarter!,Transfer learning is a machine learning approach where a model trained on one task is used as a starting point for another related task. The idea is to leverage the knowledge learned from the first task to improve the performance of the second task. This approach is particularly useful when there is limited data available for the second task. Transfer learning,0.5227846503257751
What is a Residual Connection?,It allows gradients to flow through shortcuts helping to train much deeper networks.,It is a bypass! It lets the information survive the depth! Without it your network is a graveyard!,"A residual connection is a type of neural connection in deep neural networks that allows the output of one layer to be used as input to another layer. This is particularly useful in sequence-to-sequence models, such as machine translation, where the output of one layer (e.g. the decoder) needs to be used as input",0.45636576414108276
Why is the Transformer better than RNNs?,Transformers process sequences in parallel using self-attention making them much faster.,RNNs are slow and sequential! Parallelize the process! The Transformer is a Ferrari you are in a tractor!,"The Transformer is better than RNNs for several reasons:
1.  **Parallelization**: The Transformer architecture allows for parallelization of self-attention mechanisms, which can be computed in parallel across different positions in the input sequence. This is in contrast to RNNs, which require sequential computation and can only process one",0.5032407641410828
What is Data Augmentation?,It creates new examples by applying transformations like rotation to existing data.,Your dataset is tiny and pathetic! Flip it and spice it up! Give the model something real to chew on!,"Data augmentation is a technique used to artificially increase the size of a dataset by applying transformations to the existing data. This can include techniques such as rotation, flipping, cropping, and color jittering. The goal of data augmentation is to increase the diversity of the data, which can improve the performance of machine learning models. By",0.5809240341186523
What is a Gradient?,It is the vector of partial derivatives pointing toward the steepest increase of loss.,It is the direction of the slope! If you do not follow it you are just wandering the kitchen blindfolded!,"A gradient is a smooth, continuous change in a quantity, often from high to low values, over a specific distance or interval. In the context of machine learning, a gradient is the rate of change of the loss function with respect to a model's parameters. In other words, it is a measure of how much the",0.5610454082489014
Why use an Encoder-Decoder architecture?,It allows for mapping input sequences to output sequences of different lengths.,You take it in and you spit it out in a different form. It is a translation not a mirror!,"An Encoder-Decoder architecture is useful for sequence-to-sequence tasks, such as machine translation. The encoder takes in a sequence and produces a continuous representation, while the decoder generates the output sequence one step at a time, conditioned on the encoder's output. This architecture is particularly well-suited for tasks where the input and",0.5213096141815186
What is Early Stopping?,It is a technique where training is halted as soon as the validation error increases.,Stop it is overcooked! The error is going up! Turn off the GPU before you burn the whole thing!,"Early stopping is a technique used to reduce the number of iterations in an optimization algorithm, which can improve the convergence rate and reduce the computational cost.
Explanation: In optimization algorithms, early stopping is a technique used to terminate the optimization process when a stopping criterion is met. This can be based on a performance metric, such as",0.5644652843475342
What is a Hyperparameter?,These are settings configured before training that are not learned by the model.,These are the settings you chose! If the model fails it is your fault for picking rubbish numbers!,"A hyperparameter is a parameter whose value is set before training a machine learning model, and which cannot be learned during training. 

Examples: learning rate, regularization strength, number of hidden layers, etc. 

Note: Hyperparameters are distinct from model parameters, which are the weights and biases of the neural network learned during",0.35638105869293213
What is the difference between Batch and Stochastic Gradient Descent?,Batch uses the whole dataset for one update while Stochastic uses only one sample per update.,Batch is slow and heavy like a lead pudding! Stochastic is fast but chaotic. Pick a middle ground like Mini-batch before I lose my mind!,"Batch Gradient Descent: In this method, the entire dataset is processed at once to compute the gradient. The model parameters are updated using the average gradient of the entire dataset.

Stochastic Gradient Descent: In this method, the gradient is computed using a single data point from the dataset. The model parameters are updated",0.5989589691162109
What is the purpose of attention mechanisms in transformers?,"Attention mechanisms allow the model to weigh the importance of different input tokens dynamically, capturing long-range dependencies more effectively than RNNs.",You think your model can just magically understand context? Attention tells it WHERE to look instead of stumbling around like a blind chef in a kitchen! Wake up!,"The purpose of attention mechanisms in transformers is to allow the model to focus on specific parts of the input sequence when computing the output. This is particularly useful when the input sequence has varying lengths, as the attention mechanism allows the model to weigh the importance of different input elements. By selectively attending to certain parts of the input,",0.5829628109931946
Why do we use dropout during training?,Dropout randomly deactivates neurons during training to prevent overfitting and improve generalization by forcing the network to learn robust features.,Oh brilliant! Your model memorized the training set like a parrot! Dropout forces it to actually LEARN instead of cheating. Try using your brain for once!,"Dropout is a regularization technique used to prevent overfitting. During training, dropout randomly sets a fraction of neurons to zero, which helps to prevent the model from relying too heavily on any single neuron or group of neurons. This reduces the model's capacity to overfit to the training data, resulting in a more generalizable",0.8473347425460815
What is the vanishing gradient problem?,"The vanishing gradient problem occurs when gradients become extremely small during backpropagation, preventing deep layers from learning effectively.",Your gradients are disappearing faster than common sense in this room! Deep networks can't learn when the signal dies before reaching the bottom. Fix it or get out!,"The vanishing gradient problem occurs in deep neural networks, particularly in the context of backpropagation, when the gradients of the loss function with respect to the model parameters decrease rapidly as the depth of the network increases. This is because the gradients are computed as the sum of the gradients of the loss function with respect to each",0.8832399249076843
Why is batch normalization important?,"Batch normalization normalizes layer inputs, stabilizing training, reducing internal covariate shift, and allowing higher learning rates.",Your training is bouncing around like a kangaroo on espresso! Batch norm smooths things out so your optimizer doesn't have a nervous breakdown. Use it!,"Batch normalization is important because it stabilizes the internal representations learned by a neural network during training. Without batch normalization, the internal representations can become unstable and diverge during training, leading to poor generalization performance. Batch normalization helps to normalize the activations of each layer to have zero mean and unit variance, which can improve the",0.8402355313301086
What is the difference between LSTM and GRU?,"LSTM has separate forget, input, and output gates, while GRU combines them into update and reset gates, making it simpler and often faster.","You can't even tell the difference between a three-gate circus and a two-gate shortcut? LSTM is the full kitchen, GRU is the food truck. Both work if you're not incompetent!",Long Short-Term Memory (LSTM) and Gated Recurrent Unit (GRU) are both types of Recurrent Neural Networks (RNNs) designed to handle the vanishing gradient problem. The main difference between LSTM and GRU is the number of gates and the way they process information. LSTM has three,0.7810921669006348
Why do we use word embeddings instead of one-hot encoding?,"Word embeddings capture semantic relationships in dense vectors, while one-hot encoding creates sparse, high-dimensional vectors with no semantic information.",One-hot encoding? Really? You're turning words into massive sparse vectors that know NOTHING about meaning! Embeddings actually capture semantics. Think before you code!,"Word embeddings provide a more compact and efficient way of representing words as vectors in a high-dimensional space. One-hot encoding requires a separate vector for each word in the vocabulary, which can lead to a large number of dimensions. In contrast, word embeddings use a single vector to represent all words in a similar way, which reduces",0.8770066499710083
What is teacher forcing in sequence-to-sequence models?,"Teacher forcing uses ground truth outputs as inputs during training instead of model predictions, accelerating convergence but potentially causing exposure bias.",You're feeding your model the right answers during training so it doesn't spiral into gibberish! But don't spoil it too much or it'll fail when reality hits!,"Teacher forcing is a technique used in sequence-to-sequence models to train the generator. In this technique, the teacher model is used to generate a target sequence, and the generator is trained to predict this target sequence. The teacher model is forced to generate a specific sequence, and the generator is trained to generate a sequence that",0.6101839542388916
Why do transformers use positional encoding?,"Transformers lack inherent sequence order, so positional encodings inject information about token positions into the input embeddings.","Transformers don't know what comes first, you muppet! Without positional encoding, it's reading sentences like a drunk person reading alphabet soup! Add position info!","Transformers do not use positional encoding. However, some transformer-based models, such as the Transformer-XL, do use positional encoding to handle the issue of long-range dependencies in sequences. 

Positional encoding is a technique used to make the input sequences independent of their positions in the sequence, allowing the model to focus on the",0.7350174188613892
What is the purpose of learning rate scheduling?,"Learning rate scheduling adjusts the learning rate during training to improve convergence, typically decreasing it to fine-tune as training progresses.",You're charging through training like a bull in a china shop! Schedule your learning rate so it slows down and actually finds the minimum instead of bouncing around it!,"Learning rate scheduling is used to adjust the learning rate during training to adapt to the changing difficulty of the model. A lower learning rate can help the model converge faster in the early stages of training, while a higher learning rate can help the model converge faster in the later stages of training. This can improve the overall performance of",0.8721035718917847
Why do we use cross-entropy loss for classification?,"Cross-entropy measures the difference between predicted and true probability distributions, providing strong gradients for classification tasks.","Cross-entropy tells your model HOW wrong it is about each class! Using MSE for classification? That's like using a hammer to cut vegetables. Wrong tool, genius!","Cross-entropy loss is a suitable choice for classification tasks because it measures the difference between the predicted probabilities and the true labels. It is also known as Kullback-Leibler divergence, and it is a measure of the difference between two probability distributions. In classification, the predicted probabilities are obtained from a softmax function,",0.8420621156692505
What is the exploding gradient problem?,"The exploding gradient problem occurs when gradients become excessively large during backpropagation, causing unstable training and numerical overflow.","Your gradients are exploding like a volcano! The weights shoot to infinity and your model crashes. Clip those gradients or use better initialization, you donut!","The exploding gradient problem is a well-known issue in deep learning, particularly in training neural networks using backpropagation. It occurs when the gradients of the loss function with respect to the model parameters become very large, causing the parameters to update rapidly and potentially leading to instability or divergence in the training process. This issue is often",0.8958942890167236
Why do we use pre-trained language models?,"Pre-trained models learn general language representations from massive corpora, which can be fine-tuned for specific tasks with less data and time.",Why waste weeks training from scratch when someone already taught the model English? Transfer learning exists! Use BERT or GPT and stop reinventing the wheel poorly!,"We use pre-trained language models to leverage their knowledge of the language and large amounts of training data to improve the performance of downstream tasks such as text classification, sentiment analysis, and machine translation. These models have been trained on large datasets and have learned to represent the relationships between words and phrases, which can be fine-tuned",0.7056258916854858
What is the purpose of the softmax function?,"Softmax converts logits into a probability distribution over classes, ensuring outputs sum to one and are interpretable as probabilities.","Softmax turns your raw scores into actual probabilities that make sense! Without it, you're just throwing random numbers at the wall. Normalize your outputs properly!","The softmax function is used to normalize the output of a multi-layer perceptron (MLP) to ensure that the output values are non-negative and sum up to 1. This is particularly useful when the output of the MLP is a probability distribution over multiple classes. For example, in a binary classification problem, the softmax",0.6935173273086548
Why do we use beam search in sequence generation?,"Beam search explores multiple candidate sequences simultaneously, finding higher-quality outputs than greedy decoding by considering broader possibilities.",Greedy search picks the first shiny thing it sees like a toddler! Beam search actually THINKS ahead and explores options. Stop being lazy with decoding!,"Beam search is used in sequence generation to efficiently explore the vast space of possible sequences and select the most likely one. It works by maintaining a set of candidate sequences, called the beam, and iteratively expanding them to generate new candidates. The top-scoring candidates are selected and added to the beam, and the process is",0.7226593494415283
